,"приобрел сей девайс, сейчас тестирую. 1.корпус добротный, даже слишком... хотелось бы поизящней. хотя прочность превыше всего. 2. аккумулятор держит около часа 3. поддерживает микро SD до 8Гб 4. Libelle навигация - проект стартовал 26 марта, сейчас активно разрабатывается, находится в процессе постояного совершенствования. На сайте Libelle энтузиасты тестируют карты украины, обсуждают. помогают корректировать. Загрузил карты Европы и не смог наити там ряд городов где отдыхал... Зато под Libelle навигатор быстро стартует. 5. Поставил дополнительно Igo Primo и Automap -у - работают. Плюсы: Прочный корпус, можно ставить альтернативные программы навигации, есть доп.функции (трансмиттер, е-бук, просмотр картинок и фильмов, игры). Минусы: С Libelle можно ездить пока только по Украине (заграницу страшновато) - нужно ставить другое ПО."
,"Подскажите, пожалуйста, как активировать (настроить) звук на встроенный динамик, потому что после покупки он идёт только на наружный выход (( ."
,"Отнес Навигатор знакомым, те закачали в него обновление. Работает. только когда заходишь в меню&quot;что рядом&quot;, выдает ошибку. Инструкция не указывает на то, как активировать карты мира."
,"тут є слот для карт памяті чи немає? на різних сайтах різна інформація..."
5,"Очень понравилось новое ПО ,которое на нём установлено. А особенно , то , что с ним идёт подробная карта Украины в комплекте. А остальные можно по желанию добавлять бесплатно."
,"Весьма недоволен товаром. Работал пару дней, затем выдал критическую ошибку и перестал загружать систему навигации. Звонил в техподдержку-оба телефона недоступны. Буду заморачиваться с ремонтом по гарантии, если конечно таковым кто-то в Одессе занимается. Карт мира там нет и в помине, только карта Украины."
,"А экран реагирует на нажатияя пальцами или только стилусом??"
,"Подскажите пожалуйста, как обновить карту libelle! Если можно пошаговую инструкцию. Заранее благодарен."
4,"Hd оно и в Африке HD, c таким экраном конкуренты могут только облизываться !)"
4,"HD оно и в африке HD, так что делайте выводы. Я доволен."
