,"на этой модели можно поставить грузовой транспорт, или карты закачать грузового транспорта ?"
,"Добрий день. Чи є у даному навігаторі відеовхід для підключення камери заднього огляду? На фото 3 (задня панель) є напис AV IN, але у характеристиках ніде не вказано про наявність відеовходу."
,"В первый же день после покупки перестала работать кнопка включения навигатора. Вариант возврат товара не рассматривался, т.к две недели истекли, гарантийного обслуживания тоже (проживаю в одной из псевдореспублик). Поэтому вскрыл самостоятельно. Толкатель не доставал до самой кнопки на плате, т.к последняя едва не отваливалась. Внутри убогая сборка с применением бумажного скотча и клеевого пистолета. Жуть...Закрыл и перекрестился. Думаю, для него цена уж слишком высока."
,"Какой GPS чипсет??"
,"Простой и надежный навигатор, плюс функциональные возможности обширный. Всё понравилось, всем доволен! Думаю, что если бы выбирал навигатор еще раз, то купил именно этот. Мне подошел на все сто."
,"Прикольный навигатор, быстро ловит спутники, быстро прокладывает маршруты и управление удобное, как на смартфоне. По картам: я поставил Либель по совету друга и не жалуюсь. Для Украины это лучшие карты, на мой взгляд, всё очень подробно: номера домов, магазины, гостиницы, банкоматы, всё отмечено."
,"Есть ли в устройстве bluetooth?"
,"В управлении не сложнее смартфона, спутники ловит отлично, за 10 дней в работе ни разу не подвел. По картам: поставил пока пробную версию либель, остался доволен, Украина очень детально прорисована, думаю куплю полную версию ПО. Благо недорогое."
,"Нормальный аппарат по всем параметрам. Как раз небольшой, каким и должен быть навигатор на мой взгляд. Функционал полноценного планшета и качественный GPS. Лично я пользуюсь картами и мультимедийными функциями, они тут на высоте)))"
,"Он идёт голый? Без ПО ?"
,"Управлять не сложнее чем телефоном, с программой навигации тоже разобрался быстро, прочел инструкцию. Работает аппарат шустро и не глючит, так что это теперь мой надежный штурман."
,"Мне в машину вписался отлично. Сам по себе не большой, обзору не мешает, а по функциям не уступает планшетам. Почту можно проверить, интернет полистать в кафешке с вай-фаем, водит по дорогам правильно, еще не подводил не разу. Правда, пока только по своему городу ездил. В городе знает где каждый дом находится. Очень доволен, что купил себе такую штуковину. Значительно облегчает жизнь."
,"Простой в управлении, функциональный и стильный. По навгации и картам претензий нет. Всё просто отлично, если с программкой разобраться и интрукцию почитать. Ну а андроид дает много возможностей типа приложений разных, социальных сетей и так далее. Спасибо!)"
,"Какое ПО в комплекте идет???"
